"Metric","Status","Your Code","Your Range","Xeva","Xeva Range","Key Difference"
"Baseline (v0)","Deliberate deviation","Earliest measurement with time ≤ 3 d","0–3 d","volume[1] — first recorded row (assumed day 0)","day 0","Yours tolerates a few days of slack when locating day 0; Xeva assumes the first row already is baseline."
"Best Response (BR)","Matches Xeva","min( (V / v0 − 1) × 100 ) for t ≥ 10 d","10–60 d","min( (V / v0 − 1) × 100 ) for t ≥ min.time (10 d)","10 d – ∞","Formula matches Gao et al. 2015 / Xeva exactly. Only the upper cap differs — you stop the search at 60 d; Xeva's default has none."
"Best Avg. Response (BAR)","Matches Xeva","min( running mean of (V/v0−1)×100, day 0→t ) for t ≥ 10 d","10–60 d","min( running mean of (V/v0−1)×100, day 0→t ) for t ≥ min.time (10 d)","10 d – ∞","Rewritten from a “3 lowest readings” heuristic to match the paper's running-average definition exactly. Same 60 d cap difference as BR."
"mRECIST classification","Matches Xeva","CR: BR<−95 & BAR<−40 · PR: BR<−50 & BAR<−20 · SD: BR<35 & BAR<30 · else PD","10–60 d","Same thresholds, strict “<”, evaluated PD → SD → PR → CR","10 d – ∞","Thresholds and comparison operators are now identical; any remaining divergence comes only from the BR/BAR window difference above."
"AUC","Deliberate deviation","trapz(volume, time)","0–28 d","trapz(volume, time)","0 d – ∞","Formula matches exactly. The fixed 28 d window is deliberate — it keeps AUC comparable across mice with different follow-up durations, which Xeva's unbounded default does not guarantee."
"Slope (per mouse)","Deliberate deviation","atan( slope of lm(V−v(0) ~ t−t(0), no intercept) ), degrees","0–28 d","atan( slope of lm(V−v(0) ~ t−t(0), no intercept) ), degrees","0 d – ∞","Formula matches exactly (baseline-subtracted, origin-forced regression). Same fixed-window rationale as AUC."
"TGI (per mouse)","No Xeva equivalent","1 − (T_last / T0) / mean(C_last / C0)","0–28 d","— no mouse-level TGI concept in Xeva","N/A","Xeva only defines TGI at the batch level; this per-mouse intermediate value has no direct counterpart."